icd10_code,description,measure
A1801,Tuberculosis of spine,CMR_AUTOIMMUNE
A1802,Tuberculous arthritis of other joints,CMR_AUTOIMMUNE
A1884,Tuberculosis of heart,CMR_VALVE
A3282,Listerial endocarditis,CMR_VALVE
A3951,Meningococcal endocarditis,CMR_VALVE
A3984,Postmeningococcal arthritis,CMR_AUTOIMMUNE
A5145,Secondary syphilitic hepatitis,CMR_LIVER_MLD
A5200,"Cardiovascular syphilis, unspecified",CMR_PERIVASC
A5201,Syphilitic aneurysm of aorta,CMR_PERIVASC
A5202,Syphilitic aortitis,CMR_PERIVASC
A5203,Syphilitic endocarditis,CMR_VALVE
A5209,Other cardiovascular syphilis,CMR_PERIVASC
A5274,Syphilis of liver and other viscera,CMR_LIVER_MLD
A5441,Gonococcal spondylopathy,CMR_AUTOIMMUNE
A5442,Gonococcal arthritis,CMR_AUTOIMMUNE
B180,Chronic viral hepatitis B with delta-agent,CMR_LIVER_MLD
B181,Chronic viral hepatitis B without delta-agent,CMR_LIVER_MLD
B182,Chronic viral hepatitis C,CMR_LIVER_MLD
B188,Other chronic viral hepatitis,CMR_LIVER_MLD
B189,"Chronic viral hepatitis, unspecified",CMR_LIVER_MLD
B190,Unspecified viral hepatitis with hepatic coma,CMR_LIVER_SEV
B1910,Unspecified viral hepatitis B without hepatic coma,CMR_LIVER_MLD
B1911,Unspecified viral hepatitis B with hepatic coma,CMR_LIVER_SEV
B1920,Unspecified viral hepatitis C without hepatic coma,CMR_LIVER_MLD
B1921,Unspecified viral hepatitis C with hepatic coma,CMR_LIVER_SEV
B199,Unspecified viral hepatitis without hepatic coma,CMR_LIVER_MLD
B20,Human immunodeficiency virus [HIV] disease,CMR_AIDS
B251,Cytomegaloviral hepatitis,CMR_LIVER_MLD
B3321,Viral endocarditis,CMR_VALVE
B376,Candidal endocarditis,CMR_VALVE
B581,Toxoplasma hepatitis,CMR_LIVER_MLD
C000,Malignant neoplasm of external upper lip,CMR_CANCER_SOLID
C001,Malignant neoplasm of external lower lip,CMR_CANCER_SOLID
C002,"Malignant neoplasm of external lip, unspecified",CMR_CANCER_SOLID
C003,"Malignant neoplasm of upper lip, inner aspect",CMR_CANCER_SOLID
C004,"Malignant neoplasm of lower lip, inner aspect",CMR_CANCER_SOLID
C005,"Malignant neoplasm of lip, unspecified, inner aspect",CMR_CANCER_SOLID
C006,"Malignant neoplasm of commissure of lip, unspecified",CMR_CANCER_SOLID
C008,Malignant neoplasm of overlapping sites of lip,CMR_CANCER_SOLID
C009,"Malignant neoplasm of lip, unspecified",CMR_CANCER_SOLID
C01,Malignant neoplasm of base of tongue,CMR_CANCER_SOLID
C020,Malignant neoplasm of dorsal surface of tongue,CMR_CANCER_SOLID
C021,Malignant neoplasm of border of tongue,CMR_CANCER_SOLID
C022,Malignant neoplasm of ventral surface of tongue,CMR_CANCER_SOLID
C023,"Malignant neoplasm of anterior two-thirds of tongue, part unspecified",CMR_CANCER_SOLID
C024,Malignant neoplasm of lingual tonsil,CMR_CANCER_SOLID
C028,Malignant neoplasm of overlapping sites of tongue,CMR_CANCER_SOLID
C029,"Malignant neoplasm of tongue, unspecified",CMR_CANCER_SOLID
C030,Malignant neoplasm of upper gum,CMR_CANCER_SOLID
C031,Malignant neoplasm of lower gum,CMR_CANCER_SOLID
C039,"Malignant neoplasm of gum, unspecified",CMR_CANCER_SOLID
C040,Malignant neoplasm of anterior floor of mouth,CMR_CANCER_SOLID
C041,Malignant neoplasm of lateral floor of mouth,CMR_CANCER_SOLID
C048,Malignant neoplasm of overlapping sites of floor of mouth,CMR_CANCER_SOLID
C049,"Malignant neoplasm of floor of mouth, unspecified",CMR_CANCER_SOLID
C050,Malignant neoplasm of hard palate,CMR_CANCER_SOLID
C051,Malignant neoplasm of soft palate,CMR_CANCER_SOLID
C052,Malignant neoplasm of uvula,CMR_CANCER_SOLID
C058,Malignant neoplasm of overlapping sites of palate,CMR_CANCER_SOLID
C059,"Malignant neoplasm of palate, unspecified",CMR_CANCER_SOLID
C060,Malignant neoplasm of cheek mucosa,CMR_CANCER_SOLID
C061,Malignant neoplasm of vestibule of mouth,CMR_CANCER_SOLID
C062,Malignant neoplasm of retromolar area,CMR_CANCER_SOLID
C0680,Malignant neoplasm of overlapping sites of unspecified parts of mouth,CMR_CANCER_SOLID
C0689,Malignant neoplasm of overlapping sites of other parts of mouth,CMR_CANCER_SOLID
C069,"Malignant neoplasm of mouth, unspecified",CMR_CANCER_SOLID
C07,Malignant neoplasm of parotid gland,CMR_CANCER_SOLID
C080,Malignant neoplasm of submandibular gland,CMR_CANCER_SOLID
C081,Malignant neoplasm of sublingual gland,CMR_CANCER_SOLID
C089,"Malignant neoplasm of major salivary gland, unspecified",CMR_CANCER_SOLID
C090,Malignant neoplasm of tonsillar fossa,CMR_CANCER_SOLID
C091,Malignant neoplasm of tonsillar pillar (anterior) (posterior),CMR_CANCER_SOLID
C098,Malignant neoplasm of overlapping sites of tonsil,CMR_CANCER_SOLID
C099,"Malignant neoplasm of tonsil, unspecified",CMR_CANCER_SOLID
C100,Malignant neoplasm of vallecula,CMR_CANCER_SOLID
C101,Malignant neoplasm of anterior surface of epiglottis,CMR_CANCER_SOLID
C102,Malignant neoplasm of lateral wall of oropharynx,CMR_CANCER_SOLID
C103,Malignant neoplasm of posterior wall of oropharynx,CMR_CANCER_SOLID
C104,Malignant neoplasm of branchial cleft,CMR_CANCER_SOLID
C108,Malignant neoplasm of overlapping sites of oropharynx,CMR_CANCER_SOLID
C109,"Malignant neoplasm of oropharynx, unspecified",CMR_CANCER_SOLID
C110,Malignant neoplasm of superior wall of nasopharynx,CMR_CANCER_SOLID
C111,Malignant neoplasm of posterior wall of nasopharynx,CMR_CANCER_SOLID
C112,Malignant neoplasm of lateral wall of nasopharynx,CMR_CANCER_SOLID
C113,Malignant neoplasm of anterior wall of nasopharynx,CMR_CANCER_SOLID
C118,Malignant neoplasm of overlapping sites of nasopharynx,CMR_CANCER_SOLID
C119,"Malignant neoplasm of nasopharynx, unspecified",CMR_CANCER_SOLID
C12,Malignant neoplasm of pyriform sinus,CMR_CANCER_SOLID
C130,Malignant neoplasm of postcricoid region,CMR_CANCER_SOLID
C131,"Malignant neoplasm of aryepiglottic fold, hypopharyngeal aspect",CMR_CANCER_SOLID
C132,Malignant neoplasm of posterior wall of hypopharynx,CMR_CANCER_SOLID
C138,Malignant neoplasm of overlapping sites of hypopharynx,CMR_CANCER_SOLID
C139,"Malignant neoplasm of hypopharynx, unspecified",CMR_CANCER_SOLID
C140,"Malignant neoplasm of pharynx, unspecified",CMR_CANCER_SOLID
C142,Malignant neoplasm of Waldeyer's ring,CMR_CANCER_SOLID
C148,"Malignant neoplasm of overlapping sites of lip, oral cavity and pharynx",CMR_CANCER_SOLID
C153,Malignant neoplasm of upper third of esophagus,CMR_CANCER_SOLID
C154,Malignant neoplasm of middle third of esophagus,CMR_CANCER_SOLID
C155,Malignant neoplasm of lower third of esophagus,CMR_CANCER_SOLID
C158,Malignant neoplasm of overlapping sites of esophagus,CMR_CANCER_SOLID
C159,"Malignant neoplasm of esophagus, unspecified",CMR_CANCER_SOLID
C160,Malignant neoplasm of cardia,CMR_CANCER_SOLID
C161,Malignant neoplasm of fundus of stomach,CMR_CANCER_SOLID
C162,Malignant neoplasm of body of stomach,CMR_CANCER_SOLID
C163,Malignant neoplasm of pyloric antrum,CMR_CANCER_SOLID
C164,Malignant neoplasm of pylorus,CMR_CANCER_SOLID
C165,"Malignant neoplasm of lesser curvature of stomach, unspecified",CMR_CANCER_SOLID
C166,"Malignant neoplasm of greater curvature of stomach, unspecified",CMR_CANCER_SOLID
C168,Malignant neoplasm of overlapping sites of stomach,CMR_CANCER_SOLID
C169,"Malignant neoplasm of stomach, unspecified",CMR_CANCER_SOLID
C170,Malignant neoplasm of duodenum,CMR_CANCER_SOLID
C171,Malignant neoplasm of jejunum,CMR_CANCER_SOLID
C172,Malignant neoplasm of ileum,CMR_CANCER_SOLID
C173,"Meckel's diverticulum, malignant",CMR_CANCER_SOLID
C178,Malignant neoplasm of overlapping sites of small intestine,CMR_CANCER_SOLID
C179,"Malignant neoplasm of small intestine, unspecified",CMR_CANCER_SOLID
C180,Malignant neoplasm of cecum,CMR_CANCER_SOLID
C181,Malignant neoplasm of appendix,CMR_CANCER_SOLID
C182,Malignant neoplasm of ascending colon,CMR_CANCER_SOLID
C183,Malignant neoplasm of hepatic flexure,CMR_CANCER_SOLID
C184,Malignant neoplasm of transverse colon,CMR_CANCER_SOLID
C185,Malignant neoplasm of splenic flexure,CMR_CANCER_SOLID
C186,Malignant neoplasm of descending colon,CMR_CANCER_SOLID
C187,Malignant neoplasm of sigmoid colon,CMR_CANCER_SOLID
C188,Malignant neoplasm of overlapping sites of colon,CMR_CANCER_SOLID
C189,"Malignant neoplasm of colon, unspecified",CMR_CANCER_SOLID
C19,Malignant neoplasm of rectosigmoid junction,CMR_CANCER_SOLID
C20,Malignant neoplasm of rectum,CMR_CANCER_SOLID
C210,"Malignant neoplasm of anus, unspecified",CMR_CANCER_SOLID
C211,Malignant neoplasm of anal canal,CMR_CANCER_SOLID
C212,Malignant neoplasm of cloacogenic zone,CMR_CANCER_SOLID
C218,"Malignant neoplasm of overlapping sites of rectum, anus and anal canal",CMR_CANCER_SOLID
C220,Liver cell carcinoma,CMR_CANCER_SOLID
C221,Intrahepatic bile duct carcinoma,CMR_CANCER_SOLID
C222,Hepatoblastoma,CMR_CANCER_SOLID
C223,Angiosarcoma of liver,CMR_CANCER_SOLID
C224,Other sarcomas of liver,CMR_CANCER_SOLID
C227,Other specified carcinomas of liver,CMR_CANCER_SOLID
C228,"Malignant neoplasm of liver, primary, unspecified as to type",CMR_CANCER_SOLID
C229,"Malignant neoplasm of liver, not specified as primary or secondary",CMR_CANCER_SOLID
C23,Malignant neoplasm of gallbladder,CMR_CANCER_SOLID
C240,Malignant neoplasm of extrahepatic bile duct,CMR_CANCER_SOLID
C241,Malignant neoplasm of ampulla of Vater,CMR_CANCER_SOLID
C248,Malignant neoplasm of overlapping sites of biliary tract,CMR_CANCER_SOLID
C249,"Malignant neoplasm of biliary tract, unspecified",CMR_CANCER_SOLID
C250,Malignant neoplasm of head of pancreas,CMR_CANCER_SOLID
C251,Malignant neoplasm of body of pancreas,CMR_CANCER_SOLID
C252,Malignant neoplasm of tail of pancreas,CMR_CANCER_SOLID
C253,Malignant neoplasm of pancreatic duct,CMR_CANCER_SOLID
C254,Malignant neoplasm of endocrine pancreas,CMR_CANCER_SOLID
C257,Malignant neoplasm of other parts of pancreas,CMR_CANCER_SOLID
C258,Malignant neoplasm of overlapping sites of pancreas,CMR_CANCER_SOLID
C259,"Malignant neoplasm of pancreas, unspecified",CMR_CANCER_SOLID
C260,"Malignant neoplasm of intestinal tract, part unspecified",CMR_CANCER_SOLID
C261,Malignant neoplasm of spleen,CMR_CANCER_SOLID
C269,Malignant neoplasm of ill-defined sites within the digestive system,CMR_CANCER_SOLID
C300,Malignant neoplasm of nasal cavity,CMR_CANCER_SOLID
C301,Malignant neoplasm of middle ear,CMR_CANCER_SOLID
C310,Malignant neoplasm of maxillary sinus,CMR_CANCER_SOLID
C311,Malignant neoplasm of ethmoidal sinus,CMR_CANCER_SOLID
C312,Malignant neoplasm of frontal sinus,CMR_CANCER_SOLID
C313,Malignant neoplasm of sphenoid sinus,CMR_CANCER_SOLID
C318,Malignant neoplasm of overlapping sites of accessory sinuses,CMR_CANCER_SOLID
C319,"Malignant neoplasm of accessory sinus, unspecified",CMR_CANCER_SOLID
C320,Malignant neoplasm of glottis,CMR_CANCER_SOLID
C321,Malignant neoplasm of supraglottis,CMR_CANCER_SOLID
C322,Malignant neoplasm of subglottis,CMR_CANCER_SOLID
C323,Malignant neoplasm of laryngeal cartilage,CMR_CANCER_SOLID
C328,Malignant neoplasm of overlapping sites of larynx,CMR_CANCER_SOLID
C329,"Malignant neoplasm of larynx, unspecified",CMR_CANCER_SOLID
C33,Malignant neoplasm of trachea,CMR_CANCER_SOLID
C3400,Malignant neoplasm of unspecified main bronchus,CMR_CANCER_SOLID
C3401,Malignant neoplasm of right main bronchus,CMR_CANCER_SOLID
C3402,Malignant neoplasm of left main bronchus,CMR_CANCER_SOLID
C3410,"Malignant neoplasm of upper lobe, unspecified bronchus or lung",CMR_CANCER_SOLID
C3411,"Malignant neoplasm of upper lobe, right bronchus or lung",CMR_CANCER_SOLID
C3412,"Malignant neoplasm of upper lobe, left bronchus or lung",CMR_CANCER_SOLID
C342,"Malignant neoplasm of middle lobe, bronchus or lung",CMR_CANCER_SOLID
C3430,"Malignant neoplasm of lower lobe, unspecified bronchus or lung",CMR_CANCER_SOLID
C3431,"Malignant neoplasm of lower lobe, right bronchus or lung",CMR_CANCER_SOLID
C3432,"Malignant neoplasm of lower lobe, left bronchus or lung",CMR_CANCER_SOLID
C3480,Malignant neoplasm of overlapping sites of unspecified bronchus and lung,CMR_CANCER_SOLID
C3481,Malignant neoplasm of overlapping sites of right bronchus and lung,CMR_CANCER_SOLID
C3482,Malignant neoplasm of overlapping sites of left bronchus and lung,CMR_CANCER_SOLID
C3490,Malignant neoplasm of unspecified part of unspecified bronchus or lung,CMR_CANCER_SOLID
C3491,Malignant neoplasm of unspecified part of right bronchus or lung,CMR_CANCER_SOLID
C3492,Malignant neoplasm of unspecified part of left bronchus or lung,CMR_CANCER_SOLID
C37,Malignant neoplasm of thymus,CMR_CANCER_SOLID
C380,Malignant neoplasm of heart,CMR_CANCER_SOLID
C381,Malignant neoplasm of anterior mediastinum,CMR_CANCER_SOLID
C382,Malignant neoplasm of posterior mediastinum,CMR_CANCER_SOLID
C383,"Malignant neoplasm of mediastinum, part unspecified",CMR_CANCER_SOLID
C384,Malignant neoplasm of pleura,CMR_CANCER_SOLID
C388,"Malignant neoplasm of overlapping sites of heart, mediastinum and pleura",CMR_CANCER_SOLID
C390,"Malignant neoplasm of upper respiratory tract, part unspecified",CMR_CANCER_SOLID
C399,"Malignant neoplasm of lower respiratory tract, part unspecified",CMR_CANCER_SOLID
C4000,Malignant neoplasm of scapula and long bones of unspecified upper limb,CMR_CANCER_SOLID
C4001,Malignant neoplasm of scapula and long bones of right upper limb,CMR_CANCER_SOLID
C4002,Malignant neoplasm of scapula and long bones of left upper limb,CMR_CANCER_SOLID
C4010,Malignant neoplasm of short bones of unspecified upper limb,CMR_CANCER_SOLID
C4011,Malignant neoplasm of short bones of right upper limb,CMR_CANCER_SOLID
C4012,Malignant neoplasm of short bones of left upper limb,CMR_CANCER_SOLID
C4020,Malignant neoplasm of long bones of unspecified lower limb,CMR_CANCER_SOLID
C4021,Malignant neoplasm of long bones of right lower limb,CMR_CANCER_SOLID
C4022,Malignant neoplasm of long bones of left lower limb,CMR_CANCER_SOLID
C4030,Malignant neoplasm of short bones of unspecified lower limb,CMR_CANCER_SOLID
C4031,Malignant neoplasm of short bones of right lower limb,CMR_CANCER_SOLID
C4032,Malignant neoplasm of short bones of left lower limb,CMR_CANCER_SOLID
C4080,Malignant neoplasm of overlapping sites of bone and articular cartilage of unspecified limb,CMR_CANCER_SOLID
C4081,Malignant neoplasm of overlapping sites of bone and articular cartilage of right limb,CMR_CANCER_SOLID
C4082,Malignant neoplasm of overlapping sites of bone and articular cartilage of left limb,CMR_CANCER_SOLID
C4090,Malignant neoplasm of unspecified bones and articular cartilage of unspecified limb,CMR_CANCER_SOLID
C4091,Malignant neoplasm of unspecified bones and articular cartilage of right limb,CMR_CANCER_SOLID
C4092,Malignant neoplasm of unspecified bones and articular cartilage of left limb,CMR_CANCER_SOLID
C410,Malignant neoplasm of bones of skull and face,CMR_CANCER_SOLID
C411,Malignant neoplasm of mandible,CMR_CANCER_SOLID
C412,Malignant neoplasm of vertebral column,CMR_CANCER_SOLID
C413,"Malignant neoplasm of ribs, sternum and clavicle",CMR_CANCER_SOLID
C414,"Malignant neoplasm of pelvic bones, sacrum and coccyx",CMR_CANCER_SOLID
C419,"Malignant neoplasm of bone and articular cartilage, unspecified",CMR_CANCER_SOLID
C430,Malignant melanoma of lip,CMR_CANCER_SOLID
C4310,"Malignant melanoma of unspecified eyelid, including canthus",CMR_CANCER_SOLID
C4311,"Malignant melanoma of right eyelid, including canthus",CMR_CANCER_SOLID
C43111,"Malignant melanoma of right upper eyelid, including canthus",CMR_CANCER_SOLID
C43112,"Malignant melanoma of right lower eyelid, including canthus",CMR_CANCER_SOLID
C4312,"Malignant melanoma of left eyelid, including canthus",CMR_CANCER_SOLID
C43121,"Malignant melanoma of left upper eyelid, including canthus",CMR_CANCER_SOLID
C43122,"Malignant melanoma of left lower eyelid, including canthus",CMR_CANCER_SOLID
C4320,Malignant melanoma of unspecified ear and external auricular canal,CMR_CANCER_SOLID
C4321,Malignant melanoma of right ear and external auricular canal,CMR_CANCER_SOLID
C4322,Malignant melanoma of left ear and external auricular canal,CMR_CANCER_SOLID
C4330,Malignant melanoma of unspecified part of face,CMR_CANCER_SOLID
C4331,Malignant melanoma of nose,CMR_CANCER_SOLID
C4339,Malignant melanoma of other parts of face,CMR_CANCER_SOLID
C434,Malignant melanoma of scalp and neck,CMR_CANCER_SOLID
C4351,Malignant melanoma of anal skin,CMR_CANCER_SOLID
C4352,Malignant melanoma of skin of breast,CMR_CANCER_SOLID
C4359,Malignant melanoma of other part of trunk,CMR_CANCER_SOLID
C4360,"Malignant melanoma of unspecified upper limb, including shoulder",CMR_CANCER_SOLID
C4361,"Malignant melanoma of right upper limb, including shoulder",CMR_CANCER_SOLID
C4362,"Malignant melanoma of left upper limb, including shoulder",CMR_CANCER_SOLID
C4370,"Malignant melanoma of unspecified lower limb, including hip",CMR_CANCER_SOLID
C4371,"Malignant melanoma of right lower limb, including hip",CMR_CANCER_SOLID
C4372,"Malignant melanoma of left lower limb, including hip",CMR_CANCER_SOLID
C438,Malignant melanoma of overlapping sites of skin,CMR_CANCER_SOLID
C439,"Malignant melanoma of skin, unspecified",CMR_CANCER_SOLID
C4400,Unspecified malignant neoplasm of skin of lip,CMR_CANCER_SOLID
C4409,Other specified malignant neoplasm of skin of lip,CMR_CANCER_SOLID
C44101,"Unspecified malignant neoplasm of skin of unspecified eyelid, including canthus",CMR_CANCER_SOLID
C44102,"Unspecified malignant neoplasm of skin of right eyelid, including canthus",CMR_CANCER_SOLID
C441021,"Unspecified malignant neoplasm of skin of right upper eyelid, including canthus",CMR_CANCER_SOLID
C441022,"Unspecified malignant neoplasm of skin of right lower eyelid, including canthus",CMR_CANCER_SOLID
C44109,"Unspecified malignant neoplasm of skin of left eyelid, including canthus",CMR_CANCER_SOLID
C441091,"Unspecified malignant neoplasm of skin of left upper eyelid, including canthus",CMR_CANCER_SOLID
C441092,"Unspecified malignant neoplasm of skin of left lower eyelid, including canthus",CMR_CANCER_SOLID
C44131,"Sebaceous cell carcinoma of skin of unspecified eyelid, including canthus",CMR_CANCER_SOLID
C441321,"Sebaceous cell carcinoma of skin of right upper eyelid, including canthus",CMR_CANCER_SOLID
C441322,"Sebaceous cell carcinoma of skin of right lower eyelid, including canthus",CMR_CANCER_SOLID
C441391,"Sebaceous cell carcinoma of skin of left upper eyelid, including canthus",CMR_CANCER_SOLID
C441392,"Sebaceous cell carcinoma of skin of left lower eyelid, including canthus",CMR_CANCER_SOLID
C44191,"Other specified malignant neoplasm of skin of unspecified eyelid, including canthus",CMR_CANCER_SOLID
C44192,"Other specified malignant neoplasm of skin of right eyelid, including canthus",CMR_CANCER_SOLID
C441921,"Other specified malignant neoplasm of skin of right upper eyelid, including canthus",CMR_CANCER_SOLID
C441922,"Other specified malignant neoplasm of skin of right lower eyelid, including canthus",CMR_CANCER_SOLID
C44199,"Other specified malignant neoplasm of skin of left eyelid, including canthus",CMR_CANCER_SOLID
C441991,"Other specified malignant neoplasm of skin of left upper eyelid, including canthus",CMR_CANCER_SOLID
C441992,"Other specified malignant neoplasm of skin of left lower eyelid, including canthus",CMR_CANCER_SOLID
C44201,Unspecified malignant neoplasm of skin of unspecified ear and external auricular canal,CMR_CANCER_SOLID
C44202,Unspecified malignant neoplasm of skin of right ear and external auricular canal,CMR_CANCER_SOLID
C44209,Unspecified malignant neoplasm of skin of left ear and external auricular canal,CMR_CANCER_SOLID
C44291,Other specified malignant neoplasm of skin of unspecified ear and external auricular canal,CMR_CANCER_SOLID
C44292,Other specified malignant neoplasm of skin of right ear and external auricular canal,CMR_CANCER_SOLID
C44299,Other specified malignant neoplasm of skin of left ear and external auricular canal,CMR_CANCER_SOLID
C44300,Unspecified malignant neoplasm of skin of unspecified part of face,CMR_CANCER_SOLID
C44301,Unspecified malignant neoplasm of skin of nose,CMR_CANCER_SOLID
C44309,Unspecified malignant neoplasm of skin of other parts of face,CMR_CANCER_SOLID
C44390,Other specified malignant neoplasm of skin of unspecified parts of face,CMR_CANCER_SOLID
C44391,Other specified malignant neoplasm of skin of nose,CMR_CANCER_SOLID
C44399,Other specified malignant neoplasm of skin of other parts of face,CMR_CANCER_SOLID
C4440,Unspecified malignant neoplasm of skin of scalp and neck,CMR_CANCER_SOLID
C4449,Other specified malignant neoplasm of skin of scalp and neck,CMR_CANCER_SOLID
C44500,Unspecified malignant neoplasm of anal skin,CMR_CANCER_SOLID
C44501,Unspecified malignant neoplasm of skin of breast,CMR_CANCER_SOLID
C44509,Unspecified malignant neoplasm of skin of other part of trunk,CMR_CANCER_SOLID
C44590,Other specified malignant neoplasm of anal skin,CMR_CANCER_SOLID
C44591,Other specified malignant neoplasm of skin of breast,CMR_CANCER_SOLID
C44599,Other specified malignant neoplasm of skin of other part of trunk,CMR_CANCER_SOLID
C44601,"Unspecified malignant neoplasm of skin of unspecified upper limb, including shoulder",CMR_CANCER_SOLID
C44602,"Unspecified malignant neoplasm of skin of right upper limb, including shoulder",CMR_CANCER_SOLID
C44609,"Unspecified malignant neoplasm of skin of left upper limb, including shoulder",CMR_CANCER_SOLID
C44691,"Other specified malignant neoplasm of skin of unspecified upper limb, including shoulder",CMR_CANCER_SOLID
C44692,"Other specified malignant neoplasm of skin of right upper limb, including shoulder",CMR_CANCER_SOLID
C44699,"Other specified malignant neoplasm of skin of left upper limb, including shoulder",CMR_CANCER_SOLID
C44701,"Unspecified malignant neoplasm of skin of unspecified lower limb, including hip",CMR_CANCER_SOLID
C44702,"Unspecified malignant neoplasm of skin of right lower limb, including hip",CMR_CANCER_SOLID
C44709,"Unspecified malignant neoplasm of skin of left lower limb, including hip",CMR_CANCER_SOLID
C44791,"Other specified malignant neoplasm of skin of unspecified lower limb, including hip",CMR_CANCER_SOLID
C44792,"Other specified malignant neoplasm of skin of right lower limb, including hip",CMR_CANCER_SOLID
C44799,"Other specified malignant neoplasm of skin of left lower limb, including hip",CMR_CANCER_SOLID
C4480,Unspecified malignant neoplasm of overlapping sites of skin,CMR_CANCER_SOLID
C4489,Other specified malignant neoplasm of overlapping sites of skin,CMR_CANCER_SOLID
C4490,"Unspecified malignant neoplasm of skin, unspecified",CMR_CANCER_SOLID
C4499,"Other specified malignant neoplasm of skin, unspecified",CMR_CANCER_SOLID
C450,Mesothelioma of pleura,CMR_CANCER_SOLID
C451,Mesothelioma of peritoneum,CMR_CANCER_SOLID
C452,Mesothelioma of pericardium,CMR_CANCER_SOLID
C457,Mesothelioma of other sites,CMR_CANCER_SOLID
C459,"Mesothelioma, unspecified",CMR_CANCER_SOLID
C460,Kaposi's sarcoma of skin,CMR_CANCER_SOLID
C461,Kaposi's sarcoma of soft tissue,CMR_CANCER_SOLID
C462,Kaposi's sarcoma of palate,CMR_CANCER_SOLID
C463,Kaposi's sarcoma of lymph nodes,CMR_CANCER_SOLID
C464,Kaposi's sarcoma of gastrointestinal sites,CMR_CANCER_SOLID
C4650,Kaposi's sarcoma of unspecified lung,CMR_CANCER_SOLID
C4651,Kaposi's sarcoma of right lung,CMR_CANCER_SOLID
C4652,Kaposi's sarcoma of left lung,CMR_CANCER_SOLID
C467,Kaposi's sarcoma of other sites,CMR_CANCER_SOLID
C469,"Kaposi's sarcoma, unspecified",CMR_CANCER_SOLID
C470,"Malignant neoplasm of peripheral nerves of head, face and neck",CMR_CANCER_SOLID
C4710,"Malignant neoplasm of peripheral nerves of unspecified upper limb, including shoulder",CMR_CANCER_SOLID
C4711,"Malignant neoplasm of peripheral nerves of right upper limb, including shoulder",CMR_CANCER_SOLID
C4712,"Malignant neoplasm of peripheral nerves of left upper limb, including shoulder",CMR_CANCER_SOLID
C4720,"Malignant neoplasm of peripheral nerves of unspecified lower limb, including hip",CMR_CANCER_SOLID
C4721,"Malignant neoplasm of peripheral nerves of right lower limb, including hip",CMR_CANCER_SOLID
C4722,"Malignant neoplasm of peripheral nerves of left lower limb, including hip",CMR_CANCER_SOLID
C473,Malignant neoplasm of peripheral nerves of thorax,CMR_CANCER_SOLID
C474,Malignant neoplasm of peripheral nerves of abdomen,CMR_CANCER_SOLID
C475,Malignant neoplasm of peripheral nerves of pelvis,CMR_CANCER_SOLID
C476,"Malignant neoplasm of peripheral nerves of trunk, unspecified",CMR_CANCER_SOLID
C478,Malignant neoplasm of overlapping sites of peripheral nerves and autonomic nervous system,CMR_CANCER_SOLID
C479,"Malignant neoplasm of peripheral nerves and autonomic nervous system, unspecified",CMR_CANCER_SOLID
C480,Malignant neoplasm of retroperitoneum,CMR_CANCER_SOLID
C481,Malignant neoplasm of specified parts of peritoneum,CMR_CANCER_SOLID
C482,"Malignant neoplasm of peritoneum, unspecified",CMR_CANCER_SOLID
C488,Malignant neoplasm of overlapping sites of retroperitoneum and peritoneum,CMR_CANCER_SOLID
C490,"Malignant neoplasm of connective and soft tissue of head, face and neck",CMR_CANCER_SOLID
C4910,"Malignant neoplasm of connective and soft tissue of unspecified upper limb, including shoulder",CMR_CANCER_SOLID
C4911,"Malignant neoplasm of connective and soft tissue of right upper limb, including shoulder",CMR_CANCER_SOLID
C4912,"Malignant neoplasm of connective and soft tissue of left upper limb, including shoulder",CMR_CANCER_SOLID
C4920,"Malignant neoplasm of connective and soft tissue of unspecified lower limb, including hip",CMR_CANCER_SOLID
C4921,"Malignant neoplasm of connective and soft tissue of right lower limb, including hip",CMR_CANCER_SOLID
C4922,"Malignant neoplasm of connective and soft tissue of left lower limb, including hip",CMR_CANCER_SOLID
C493,Malignant neoplasm of connective and soft tissue of thorax,CMR_CANCER_SOLID
C494,Malignant neoplasm of connective and soft tissue of abdomen,CMR_CANCER_SOLID
